{
  "$schema": "../../schema/meta-models.json",
  "id": "gemini-2.0-flash-lite-001",
  "name": "Gemini 2.0 Flash Lite 001",
  "creator": ["GOOGLE"],
  "published": "2025-02-25",
  "states": {
    "2024-02-25": ["STABLE"]
  },
  "cutoff_date": {
    "value": "2024-06",
    "sources": [
      "https://firebase.google.com/docs/vertex-ai/models#specs-and-limitations-comparison"
    ]
  },
  "tokens_limit": {
    "input": 1048576,
    "output": 8192
  }
}
