{
  "$schema": "../../schema/meta-models.json",
  "id": "gpt-4o-2024-11-20",
  "name": "GPT-4o (2024-11-20)",
  "creator": ["OpenAI"],
  "published": "2024-11-20",
  "states": {
    "2024-11-20": ["STABLE"]
  },
  "lmarena_id": "chatgpt-4o-latest-20241120",
  "cutoff_date": {
    "value": "2023-10"
  },
  "tokens_limit": {
    "input": 128000,
    "output": 16384
  }
}
